,pl_id,pl_model_code,pl_name,star,market,write_id,upload_day,title,text
61,126,LM-G710,G7 ThinQ,4,인터파크,choi****,19.03.19.,가격은 싸게 샀지만 고객응대는 별로,"빠X 같은 휴대폰 구매 정보 공유 사이트에서 사는 것에 비해 1만원 정도는 비싸지만, 그래도 일반적인 매장보다 훨씬 싸게 구매 가능. 그렇지만 고객응대가 매우 불량. 개통절차 설명해줄 때 잘 이해 안되는 부분 있어서 다시 물어보면 한숨 팍 쉬면서 대놓고 짜증스럽게 대응. 한번이면 이해할텐데 2~3번 통화하면서 계속 그러는거보면 직원분의 서비스마인드 자체가 문제가 있다 생각되네요."
62,126,LM-G710,G7 ThinQ,5,인터파크,tizi****,19.04.24.,상품도 배송도 좋습니다.,가격도 저렴하고 상품도 배송도 모두 마음에 들었습니다. 많이 파세요고맙습니다.   
63,126,LM-G710,G7 ThinQ,5,인터파크,jhw*****,19.02.12.,매우 추천합니다., 완전 맘에 듭니다. 너무너무 좋아요. 삼성보다 확실히 좋네요. 적극추천 합니다.
64,126,LM-G710,G7 ThinQ,5,인터파크,bkb*****,19.04.01.,좋아요,갑자기 물량이 없어 일주일정도 걸린게 아쉽지만 양품으로 잘받았습니다.
65,126,LM-G710,G7 ThinQ,5,인터파크,ka******,19.03.17.,가격 배송 모두 만족합니다.,너무 만족합니다 말씀하신 일정대로 제게 전달이 되었기도 하고요. 
66,126,LM-G710,G7 ThinQ,5,인터파크,boo*****,19.03.20.,만족합니다.,빠른 배송에 금액도 저렴해서 만족합니다. 다만 제조일로 좀 오래되었다는게 별로입니다. 감사합니다
67,126,LM-G710,G7 ThinQ,5,인터파크,p7******,19.03.14.,가성비 좋네요,다른곳보다 훨씬 저렴하고 믿음가네요!!!!!
68,126,LM-G710,G7 ThinQ,5,인터파크,yg0*****,19.03.11.,네이버에서,이거 진짜 너무 많이 하고싶어서 그냥
69,126,LM-G710,G7 ThinQ,5,인터파크,hone****,19.02.25.,상품은 만족 합니다.,저번주 수요일날 구입을 했는데...주말에 공시지원금이 높아지는 바람에 ㅜㅜ 2~3일 사이로 10만원정도 금액이 다운 되어 버렸네요 ... ㅜㅜ너무 아쉬워서 잠이 안옵니다. 
70,126,LM-G710,G7 ThinQ,5,인터파크,kiss****,18.10.27.,가격 좋고 처리가 빠르네요,저렴하고 빠르게 잘 샀습니다.
71,126,LM-G710,G7 ThinQ,5,인터파크,choi****,18.08.03.,괜춘,배송은 하루만에 왔어요. 싸게 잘산것 같습니다. 아쉬운것은 케이스와 필름이없어서 좀 불안해요. 그건 일단 주문했으니 올때까지 모시면서 다녀야죠..ㅎㅎ
72,126,LM-G710,G7 ThinQ,5,인터파크,hing****,18.07.20.,진짜 저렴하게잘샀습니다,보내주신 핸드폰도 다행히 양품으로 왔네요 기분좋네요 저렴하게 잘쓰겠습니다 대박나세요^-^
73,126,LM-G710,G7 ThinQ,5,인터파크,sbsb****,19.01.16.,쉽고 빠른 기기변경,"예전 쓰던 폰이 심하게 노후화돼서 급하게 기기변경을 신청했습니다 많은 핸드폰들 중에서 불량이나 문제점이 거의 없다고 알려진 g7 thinq로 정했고 최고의 선택이었습니다  상품설명에서는 2~3 일 걸린다고 되어있었지만 주문 하루만에 집앞까지 배송해주시더라고요 아주 빠르고 만족스러웠습니다  핸드폰은 앞뒷면으로 비닐포장이 되어있어 먼지나 지문자국이 없었고 흠집이나 크랙도 없었습니다 외관에 문제가 없는 걸 확인 후 바로 필름 씌우고 케이스 꼈습니다ㅎㅎ  핸드폰 박스 안에 이어폰, 충전기, 보호필름, 젠더도 동봉해주더군요 잘 쓰겠습니다!!"
74,126,LM-G710,G7 ThinQ,5,인터파크,aks*****,19.02.10.,잘 쓰고있습니다,  디스플레이 크기   화질  오디오 음질 다 마음에 듭니다  저렴하게 구매해서 잘 쓰는거 같습니다..  만족합니다
75,126,LM-G710,G7 ThinQ,5,인터파크,kty*****,18.11.23.,추천합니다.,"굳이 발품을 팔 필요가 없네요. 사장님도 친절하시구요. 추천드리며 번창하시길 바랍니다. 다만, 사은품이 있으면 좋겠네요. 폰만 달랑 와서^^"
76,126,LM-G710,G7 ThinQ,5,인터파크,nin*****,19.01.29.,빠른 배송 감사,결제하고 신청서도 바로 주시고 핸드폰도 당일배송 가격도 저렴하게 잘샀습니다 많이파세요~
77,126,LM-G710,G7 ThinQ,5,인터파크,s6k*****,19.01.12.,기기변경으로 구입,폰 기기변경으로 구매했어요 개통 바로 해주시고 하루만에  택배 받아서 잘쓰고있습니다 저렴하게 잘산거 같아요
78,126,LM-G710,G7 ThinQ,5,인터파크,too*****,19.01.19.,잘받았습니다,잘받았습니다 색상이로즈밖에없어서 아쉬웠는데 받고나니나름괜찮네요 !!
79,126,LM-G710,G7 ThinQ,5,인터파크,aceo****,19.01.17.,완전 잘 선택했어요,기기변경으로 계속 유플러스 쓰는것도 좋은데  가격도 완전 싸게 구입했네요 또 2~3년 잘쓰다가 또 쓰게도지 않을까 싶네요
80,126,LM-G710,G7 ThinQ,5,인터파크,eggo****,19.01.20.,잘 받았습니다,  배송도 빠르고 잘 선택한것 같아요. 색상은 라즈베리밖에 없어서 선택지가 없었는데 맘에 들어요
81,126,LM-G710,G7 ThinQ,5,인터파크,neln****,18.08.20.,맘에 들어요,사진두 선명하구  싼가격에 좋은제품 구입했습니다 번창하세요
82,126,LM-G710,G7 ThinQ,5,인터파크,cris****,18.10.10.,"깔끔하고 슬림한 디자인, 민첩한 성능",성능이야 말할것 없고 디자인 참 깔끔하게 나왔네요 카메라도 아주 좋습니다. 아웃포커싱 기능은 정말 맘에드네요 이어폰으로 음악감상시 이퀄라이저만 취향에 맞추면 아주 깔끔한 음질... 가격대비 만족합니다.
83,126,LM-G710,G7 ThinQ,5,인터파크,sh7*****,19.01.26.,참 좋네요,참 저렴하게잘 샀습니다
84,126,LM-G710,G7 ThinQ,5,인터파크,joym****,18.11.12.,좋아요,빠른 배송.  굿  몇번 문의 전화 드려도 친절하게 답해주시고 감사합니다 새 물건 믿을수있게 왔고요 지금 아주 잘 사용하고 있습니다. 감사합니다
85,126,LM-G710,G7 ThinQ,5,인터파크,pass****,18.09.16.,가성비최고,진짜자렴하게 빠른배송으로 받았습니다 부자되세요
86,126,LM-G710,G7 ThinQ,3,인터파크,pig*****,18.08.11.,사음품 중에 케이스가 빠져서 왔어요,잘 받았습니다만 사은품 중에 케이스가 빠져서 왔어요
1,127,LM-G710P,G7 ThinQ Plus,5,인터파크,hobb****,19.07.19.,아주 만족합니다.,"제품 신청에서 배송까지 하루정도 소요되었습니다. 제품 게시물과 같이 구매시 결재대금외 휴대폰과 관려된 할부원금은 없습니다.  제품도 개봉하지 않은 새제품이며, 저렴한 구매가격에 필름과 투명젤리케이스도 보내주셨습니다.  아주 만족합니다."
2,127,LM-G710P,G7 ThinQ Plus,5,인터파크,osc1****,19.03.28.,배송잘받았습니다 번창하세요,너무나도 저렴하게 구입해서 기분좋고 부산인데 하루만에와서 또 기분좋고 휴대폰오면 케이스사러 가야지 하고 생각하고있었는데  너무나 고급진 케이스2개에 고급진방탄필름까지 챙겨주시고 너무너무 감사합니다 음질도 성능도 아주마음에들어요 사업번창하세요 오래오래 잘사용하겠습니다 감사합니다
3,127,LM-G710P,G7 ThinQ Plus,5,인터파크,g*a*****,19.06.06.,추천,주문 후 해피콜 빨랐고 다음날 물건 받았습니다. 친절하고 빠른개통입니다. 추천요^^
4,127,LM-G710P,G7 ThinQ Plus,5,인터파크,dgh*****,19.05.28.,좋은 상품 감사합니다!, 접수도 빠르고 해피콜도 빠르고 배송도 빨라서 좋습니다. 좋은 상품 최고입니다!
5,127,LM-G710P,G7 ThinQ Plus,5,인터파크,c*w*****,19.08.21.,가성비갑,물건 잘 받았습니다. 휴대폰 다음에도 여기서 살게요!
6,127,LM-G710P,G7 ThinQ Plus,5,인터파크,tnwj****,19.03.29.,빠른 진행~ 좋아좋아,"주문 후 개통, 배송까지 빠르게 처리되어 불편함 없이 바꿨습니다생각보다색 너무 예쁨감사합니다~~~~ "
7,127,LM-G710P,G7 ThinQ Plus,5,인터파크,hg82****,19.07.08.,가성비가 좋음,"LG폰은 그리 인기가 좋지 않지만, 가성비는 정말 좋네요. 부디 고장 안나고 2년동안 잘 사용하였으면 합니다."
8,127,LM-G710P,G7 ThinQ Plus,5,인터파크,leeh****,19.07.14.,좋아요,저렴하게 구매했어요 ~~
9,127,LM-G710P,G7 ThinQ Plus,5,옥션,josh****,19.07.23.,아주좋아요,아주좋아요
10,127,LM-G710P,G7 ThinQ Plus,5,인터파크,pjj*****,19.06.27.,왕추천. 놓치면 후회,1마넌의 행복은 바로 이런것이죠.껄껄껄 할원 제로. 육구욕 6개월 심플코스로 유지후  변경가능. 스펙은 갤9 보다 좋은것같습니다.
11,127,LM-G710P,G7 ThinQ Plus,5,인터파크,d*l*****,19.06.13.,너무 맘에 들어요..,정말 저렴한 가격에 득템한거 같아서 좋아요 필요없는 선물대신 가격을 할인받은거 같아서 좋네요..
12,127,LM-G710P,G7 ThinQ Plus,5,인터파크,chid****,19.06.06.,g7  thinq 좋네요,"저렴한 가격에 잘 산데다 한동안 데이터도 맘놓고 쓰고, 다른분들 말처럼 신속, 친절, 정확 너무 좋네요. g7으로 글쓰고 있습니다^^"
13,127,LM-G710P,G7 ThinQ Plus,5,인터파크,pjj*****,19.06.27.,2대 기변완료,"스펙, 가격, 당일 접수후 배송까지 어느 한가지 부족함이 없네요. 2대 기변했습니다. 매우 만족합니다."
14,127,LM-G710P,G7 ThinQ Plus,5,인터파크,sun*****,19.06.24.,완전 좋아요..거의 공짜폰이네요.,"약 만원 내고, 69요금제 쓰고 6개월 후 요금 변경 가능합니다. 무제한 데이터 요금제는 56이 마지노선이라, 그리 차이나지도 않고요..."
15,127,LM-G710P,G7 ThinQ Plus,5,인터파크,e*r*****,19.06.11.,좋은가격에 잘 구매 했습니다,휴대폰 기기변경 좋은 조건으로 잘 했습니다. 고장없이 잘 쓸 일만 남았네요~^^
16,127,LM-G710P,G7 ThinQ Plus,5,인터파크,sin*****,19.06.17.,빠른배송 좋은기기,좋아요 배송은 빠르고 좋응 기기가 왔네요
17,127,LM-G710P,G7 ThinQ Plus,5,인터파크,hjd*****,19.05.22.,적극 추천합니다,"어제 주문해서 오늘 점심때 받아서 데이터 옮기고 있습니다. 친절하시고, 배송빠르고, 가성비 좋구요.... 적극 추천합니다."
18,127,LM-G710P,G7 ThinQ Plus,5,인터파크,kuk*****,19.06.14.,득템,저렴한가격 빠른배송 감사합니다
19,127,LM-G710P,G7 ThinQ Plus,5,인터파크,shin****,19.05.30.,성능 좋은 폰 싸게 사서 좋네요.,잘쓰겠습니다. 많이 파세요.
20,127,LM-G710P,G7 ThinQ Plus,5,인터파크,roi*****,19.05.05.,G7 플러스 잘 구매한 것같아요.,"사고 싶은 LG 스마트폰이었는데 저렴하게 잘 구매한 것 같습니다. 결제하고 나서 바로 메일 보내주시고, 해피콜도 빠르고, 휴대폰 배송도 빨라서 매우 만족합니다."
21,127,LM-G710P,G7 ThinQ Plus,4,인터파크,choi****,19.03.19.,가격은 싸게 샀지만 고객응대는 별로,"빠X 같은 휴대폰 구매 정보 공유 사이트에서 사는 것에 비해 1만원 정도는 비싸지만, 그래도 일반적인 매장보다 훨씬 싸게 구매 가능. 그렇지만 고객응대가 매우 불량. 개통절차 설명해줄 때 잘 이해 안되는 부분 있어서 다시 물어보면 한숨 팍 쉬면서 대놓고 짜증스럽게 대응. 한번이면 이해할텐데 2~3번 통화하면서 계속 그러는거보면 직원분의 서비스마인드 자체가 문제가 있다 생각되네요."
22,127,LM-G710P,G7 ThinQ Plus,5,인터파크,tizi****,19.04.24.,상품도 배송도 좋습니다.,가격도 저렴하고 상품도 배송도 모두 마음에 들었습니다. 많이 파세요고맙습니다.   
23,127,LM-G710P,G7 ThinQ Plus,5,인터파크,jhw*****,19.02.12.,매우 추천합니다., 완전 맘에 듭니다. 너무너무 좋아요. 삼성보다 확실히 좋네요. 적극추천 합니다.
24,127,LM-G710P,G7 ThinQ Plus,5,인터파크,bkb*****,19.04.01.,좋아요,갑자기 물량이 없어 일주일정도 걸린게 아쉽지만 양품으로 잘받았습니다.
25,127,LM-G710P,G7 ThinQ Plus,5,인터파크,ka******,19.03.17.,가격 배송 모두 만족합니다.,너무 만족합니다 말씀하신 일정대로 제게 전달이 되었기도 하고요. 
26,127,LM-G710P,G7 ThinQ Plus,5,인터파크,boo*****,19.03.20.,만족합니다.,빠른 배송에 금액도 저렴해서 만족합니다. 다만 제조일로 좀 오래되었다는게 별로입니다. 감사합니다
27,127,LM-G710P,G7 ThinQ Plus,5,인터파크,p7******,19.03.14.,가성비 좋네요,다른곳보다 훨씬 저렴하고 믿음가네요!!!!!
28,127,LM-G710P,G7 ThinQ Plus,5,인터파크,yg0*****,19.03.11.,네이버에서,이거 진짜 너무 많이 하고싶어서 그냥
29,127,LM-G710P,G7 ThinQ Plus,5,인터파크,hone****,19.02.25.,상품은 만족 합니다.,저번주 수요일날 구입을 했는데...주말에 공시지원금이 높아지는 바람에 ㅜㅜ 2~3일 사이로 10만원정도 금액이 다운 되어 버렸네요 ... ㅜㅜ너무 아쉬워서 잠이 안옵니다. 
30,127,LM-G710P,G7 ThinQ Plus,5,인터파크,kiss****,18.10.27.,가격 좋고 처리가 빠르네요,저렴하고 빠르게 잘 샀습니다.
31,127,LM-G710P,G7 ThinQ Plus,5,인터파크,choi****,18.08.03.,괜춘,배송은 하루만에 왔어요. 싸게 잘산것 같습니다. 아쉬운것은 케이스와 필름이없어서 좀 불안해요. 그건 일단 주문했으니 올때까지 모시면서 다녀야죠..ㅎㅎ
32,127,LM-G710P,G7 ThinQ Plus,5,인터파크,hing****,18.07.20.,진짜 저렴하게잘샀습니다,보내주신 핸드폰도 다행히 양품으로 왔네요 기분좋네요 저렴하게 잘쓰겠습니다 대박나세요^-^
1,130,LG-F700,G5,5,옥션,twol****,16.05.13.,진짜 진짜 기분좋은 구매입니다!!!!! ,"정말 이번 구매 너무 너무 만족스러워요 집앞에 대리점에서 하면 바로 받을수는 있지만어차피 배송이 하루밖에 안걸려서 빨리 받았어요 그리구 우체국택배라 그런지 저는 아침일찍 기사님이 오셨더라구요 총알 배송 ~ 너무 맘에 들어요 ~~~ GOOD~ 사은품도 이렇게나 많이줬어요 솔직히 프리미엄만 봐서나머지는 별 신경안썼는데 꽤 쓸만한게 있더라구요 하나하나 깨알이예요 스마트링이 아주 맘에들어요!!잘쓸께요 ~~ 저는 무난하게 티탄색으로 구매했어요 역시 깔끔하고 곡선형태로 디자인도 마음에 들어요 !!그리고 상담원 직원분도 제가 궁금한거 물어볼때마다 다 상냥하게 대답해 주셨어요 감사합니다. 그분~이름은 모르겠지만 감사드려요 덕분에 좋은구매 했습니다 인터넷으로 폰을 구매하는걸 좀 믿지못했었는데 이번 계기로 편견이 없어졌네요~ 너무 기분좋은 구매였습니다!!후기 작성시 별도로 기프티도 주신다고 되어있더라구요~저도 주실꺼죠? ㅋ,ㅋ 감사드려요 정말 바꿈 고맙네요 "
2,130,LG-F700,G5,5,인터파크,umbe****,17.08.09.,구입 잘 한거 같아요.,"구매한지 꽤 오래되었는데 이제 후기를 올리네요..우연한 기회에 최고의 특가로 구매를 하였습니다. 전부터 사용하고 싶던 핸드폰이었는데 어머님께 선물하게 되었네요.LG G5 출시가 좀 된거라 그런지 받은 제품 제조년월일이 1년도 더 된거더라구요.핸드폰 성능에는 문제가 없어 보이는데 밧데리 성능은 걱정이 됩니다. 밧데리가 한개이고 추가 사은품이 하나도 없던 것이 아쉽지만,구매 당시 구입특가로는 대만족입니다. "
3,130,LG-F700,G5,5,옥션,kam*****,16.04.21.,LG G5 구매 만족합니다.,LG L5 구매는 만족 스럽습니다.핸드폰은 잘 만든듯 하고좀 부족한 부분도 없지않아 있지만기존 지프로투보다는 확실히 좋습니다. 단점은 케이스가 문제 입니다. 한번 떨군적이 있는데 측면에 찍히니깐 페인트가 벗겨?다고 해야 되나? 암튼 약합니다. 생각보다파손이나 그런건 아니지만 찍힘이 좀 남는다는게 그렇네요두번째 굉장히 미끄럽습니다. 핸드폰이손에 감기는 맛보다는 메끈한 느낌인지라 손에서 잘 미끄러 집니다. 케이스 무조건 하는게 오래 쓸듯 싶습니다. 3번째는 충전중 온도가 약간 올라 갑니다.이건 크게 문제가 안될수도 저만 그럴수도 있는거라기존에 지프로투 보다는 굉장히 낮은 온도지만 충전중에 약간 따듯 합니다. 장점은 터지가 편합니다. 전 손가락이 커서 기존 지프로투도 잘못 터치 되는 경우가 많았는데 요번건 확실히 덜해요 크기는 더 작아졌고 자판도 더 작아 졌는데터치가 정확합니다. 보안방법이 참 많아 ?습니다. 지프로투에 비해안면인식 지문인식 여러방법으로 핸드폰 잠금을 할수 있고 해제 할수 있습니다.요즘 나오는 폰엔 다 있는 기능이지만 제꺼에는 없던 기능이라 매우 좋고 편리하게 사용하고 있습니다. 동영상이나 게임을 장시간 돌려도 발열이 낮습니다.그래픽도 게임최적화 모드를 지원해서 발열이 낮습니다.이젠 겜 하면서도 크게 걱정 안합니다. 지프로투 발열 무지 심했었습니다. ㅠㅠ 외부스피커 무지 괜찮습니다. 소리나 크기나 널리 퍼지는 정도도 괘 맘에 듭니다. 카메라를 지원하는 기능이 대폭 개선 됐습니다.카메라가 2가지 모드를 지원하는데 기존처럼 찍는 방법과 135도 광각으로 찍는 방법을 지원합니다.확실히 보다 넓은 시야각으로 많은양을 한장에 담을수 있습니다.그외 한장에 여러 사진을 답는컷도 있고 여러가지가 있어서 찍는 재미가 있습니다. 이정도까지만 적을께요 더써보고 더 좋아진게 있나 찾아 봐야 겠네요암튼 엘지 만족합니다. 통신사는 좀 . 그랬네요 가입을 목요일에 했는데 물건은 화요일날 받아서물건이 없어서 오래 걸렸다고 하는데 미리 전화 준것도 아니고 제가 일일이 전화해서 물어보고 확인 하고 그랬습니다.그렇게 친절하다고는 할수 없었네요 배송기간도 당연 오래 걸렸구요요번에 사은품 관련해도 오늘 
4,130,LG-F700,G5,2,인터파크,fjj*****,17.09.04.,최악,최악의 상품임.휴대폰 사용하고고 계속 다운되고 꺼지더니  개통한지 14일이 된 오늘은 아예 핸드폰이 커지지도 않아교환 문의를 들었더니 오늘까지 가지고 오지 않으면 교환이 되지 않는다고 하네요제가 있는 곳은 제주도인데 직접 날아가지 않는 이상 택배로는 도착할 수 없는 시간인데 알아서 해결하라는 식에 대답만 들었어요.믿고 구매 했는데 정말 인터파크 최악입니다. 
5,130,LG-F700,G5,5,인터파크,tkyo****,17.04.15.,좋아요 제일 싸게 산듯...,신도림에서 가격알아보고 샀는데 신도림보다 싸서 여기로 결정했어요.순실전자는 싫어서.. 신도림 폰장사하는 사람들은 왜 G5 사냐고 물어보면서 S7 순실전자 사라고 더 싸다고 ㅋㅋ 하지만 전 No!!!G5 다들 욕하는데 저는 만족해서 제 아내 폰으로 사준겁니다. ㅋ제꺼랑 아내폰 모두 G5 입니다.
6,130,LG-F700,G5,3,인터파크,neoj****,17.07.21.,물건은 잘 받았습니다.,물건은 잘받았는데 우선 택배기사님 불친절했어요. 집앞에 물건 던지고 가시네요. 폰 살때 적어도 보호필름이랑 케이스 정도는 주실줄 알았는데 아무것도 없이 폰만 와서 좀 아쉬웠네요. 다른곳들 보면 이것저것 챙겨주던데 에프터 서비스가 좀 부실한것 같습니다.
7,130,LG-F700,G5,5,옥션,dac1****,16.04.07.,상품 마음에 들어요,스마트폰 바꿀때가 되었어요. 주로 게임기취급 하고 있엇지만 배터리 수명 이라는게 있고 폰도 점점 병맛되어가던거에요. g3쓰고 있었거든요ㅎㅎ 나름 관리는 잘햇다 생각했는데 생각까지인듯 싶어요. 첨엔 아이뻐를 사느냐 좀만 더기다렸다가 g5를 사느냐 고민하다가 g5선택 난 lg충인가 보죠? 여튼 일하느라 배송 끝난줄도 모르고 집에 콩 박혀있다가 저녁늦게 온 택배의 한마디 경비실에 낮에 맡겨뒀어요. 네 배송 생각보다 빨랏습니다.  택배의 고충을 알기에 욕은 못하겠네요. 한두번이 아니라서ㅎㅎ 제품 개봉후 아기다루듯 조심스레 들고 새로운 게임기를 켯죠. . . 그래요 저에게 게임기 그이상 그이하도 아닙니다. 나름 심심할때 기능찾아서 써봅니다. 근데 본적없는 노크코드 보안모드가 있더라구요 설정하고보니. . . 어떻게 하는지 모름 2분동안 싸매다가 해결했더라죠 글고 인터넷 검색해보니 카메라가 신세계라길래 해봤습니다. 같은거리에서 g3로 찍어보고 g5로 해보니 확실히 다르긴 다르더래요. 나중에 써먹어봐야죠 성능도 엄청 좋은거 같더라구요. g3는 이렇게 글만 쓰는거 해도 버벅거리기도하고 다른기능켜지기도 하는데 말이죠. . . 이거 쓰고 있는와중에도 그럽니다. 정말 잘샀다는 생각해요. 판매자분 많이 파세요~^^옥션 안드로이드 앱으로 작성
8,130,LG-F700,G5,5,인터파크,sara****,17.06.09.,오 좋아요,배송은 하루 늦게 왔어요 지투에서 갈아탔는데 후면 지문인식 짱신기해요 화면크기는 지투랑 비슷 글자 지우기 속도 엄청 빠르네요 오프라인에서 알아보니 skt기기변경 물량이 없어서 인터넷에서 구매했어요. 개통 10분만에 되고 좋아요~
9,130,LG-F700,G5,5,옥션,kyum****,16.05.18.,이렇게 줘도 되나요??? 사은품 대박!!! 진짜 추천이예요 ~,"    아니 사은품을 너무 많이 주네요 ~~그리고 추가로 샤오미 캐리어까지 별도배송온다는데 너무 사은품을 막 퍼주는것 같아요 !!!저는 너무 좋치만 걱정되네요 남으니깐 주는거겠죠?다른곳도 많이 주긴하지만 뭐해야 주고 뭐해야주고너무 조건이 많고 보기도, 고르기도 힘들더라구요여기는 딱 필요한것만 3개 고르래서 골랏더니 다 알아서 왔어요 ~~g5 배터리 떼볼려고 하니깐 뿌러질것 같아서 아직 분리는 안해봤는데 이제 곧 배터리 추가사은품 오면 한번 시도다시 해봐야겠어요잘안되더라구요 ;; 이번에 사은품 증정행사로 추가로 배터리도 받고 구매한 g5 도 엄청 마음에 들고 디자인도 깔끔 뒤에 버튼있는게 아직 익숙하진 않치만아무튼 화질완전 선명하게 잘나오구 구매 엄청 만족이예요감사합니다. 샤오미캐리어 기다리고 있을께요    "
10,130,LG-F700,G5,5,옥션,kbln****,16.04.09.,기다리고 기다리던 g5 드디어 구매,(아.. 30분동안 작성한 상품평이 다날라갔네요ㅋㅋ 화납니다 으아.. 재작성중..)기다리고 기다리던 g5 드디어 구매했네요.1개월 넘게 기다렸는데 받아보니 넘 이쁘고 좋아요첨에 실버색상 하려다가 핑크 구매했는데 선택에 후회 없어요. 핑크&nbsp;완전 예쁩니당!구매 요청한 당일 빠르게 처리해주셔서 그다음날 바로 받았어요.구매처리 빠르게 해주셔서 감사합니다.배터리팩이랑 카메라모듈이 안와서 왜 안왔지 했는데 제가 따로 신청해야 하는 거였네용..스마트유에서 구입한 이유는 사은품 때문이구요!ㅋㅋ인터넷 여기저기 서핑한 결과 스마트유가 젤 괜찮더라구요.다만 사은품을 2주후에 받아야 한다는 것에 충격을 먹었지만..일처리를 믿음직하게 해주셔서 기다리고 있습니다.음.. 건의 하나 드릴까합니다.결론부터 말씀드리자면 사은품 중 휴대폰 케이스가 있는데폰 보내주실때 케이스는 동봉하여 보내주시면 좋을 것 같습니다.제 실수지만 핸드폰 받고 하루도 안되어 길거리에 폰을 떨어뜨리는 바람에..폰이 아작났어요..물론 제가 실 수 한거지만.. 새폰이 하루도안되어 중고폰이 되어버려서..제몸에 상처난 것같이 마음이 아픕니다... 하하떨어뜨린 자국과 기스.... 볼때마다 마음이 찢어집니다..ㅜㅜ그 래 서!다른 사은품은 추후에 주셔도 상관 없는데.. 어차피 주실 사은품 이라면..케이스만이라도 핸드폰과 동봉하여 주시면 좋을 것 같아 건의드립니다.추후 구매하시는 분들 저와 같은 일을 당하지 않도록 도와드리고싶네요.. 물론 제가 실수한거지만요..떨어뜨린날 케이스 주문해서 장착했는데..소잃고 외양간 고친격이 되었습니다..ㅋㅋㅋㅋㅋㅋㅋㅋ판매자님! 감사드리구요! 사은품 빨리 받아보고싶어요!!!!!ㅜㅜ
