,pl_id,pl_model_code,pl_name,star,market,write_id,upload_day,title,text
11,130,LG-F700,G5,5,옥션,dlwl****,16.04.09.,G5 대만족 입니다 ㅎㅎㅎ,g5를 수령받고 이틀만에 상품평을쓰네요. 그간 s7을 두고 엄청 고민을하다 이번 g5평이 좋아서 구매결정을하게됐는데 정말 잘 선택한거 같아요ㅎㅎ 아직 사용한지 이틀밖에 안됐지만 기능들이 하나하나 다 뛰어나고 무엇보다 광곽 카메라가 정말 신세계더군요ㄷㄷ 그리고 항상 스마트폰을 오프라인에서만 구매하다 이번에 처음으로 온라인으로 구매하게되서 조금 반신반의했지만 배송도 빠르고 개통하는법부터 해서 모두다 친절하게 설명해주셔서 별 무리없이 잘 사용하고있습니다ㅎㅎ 혹시나 스마트폰 뭘 사야할지 고민중이신 분들이 있다면 g5 강력추천!합니다옥션 안드로이드 앱으로 작성
12,130,LG-F700,G5,5,옥션,juk*****,16.04.09.,배송이 정말 빨라요,전 핸드폰이 많이 망가지고 카메라도 깨져서 다 뿌옇게 나와도 별 신경 안썼는데 이번 g5가 b&o이랑 협업해서 만든다는 소리를 듣고 g5에 대해 찾다가 매력적인 가격과 이벤트로 처음으로 인터넷으로 구매하게 되었습니다 곧 주말이고 늦게 신청해서 다음주에나 받을 줄 알았는데 배송이 거의 하루만에와서 너무 감사하단 말을 드리고싶어요 제 인생 목표 중 하나가 뱅앤올룹슨 사는건데 play부터 차근차근 밟아가려고요 배송 가격 다 만족합니다 많이 파세요  옥션 안드로이드 앱으로 작성
13,130,LG-F700,G5,5,옥션,byh3****,16.04.14.,G5 구매 매우 만족합니다,"약정도 끝나서 휴대폰 구매를 준비중 G5 출시로 구매를 여러 사이트 눈팅중 다른분들 만족도가 높아구매하였습니다. 다양한 사은품과 친절한 응대로 구매시 궁금점을  해결해 주시고 매우만족한 구매였습니다, 써보니 버젼이 달라 처음엔 약간 헤맷지만 편리한 기능이 많아 금방 익숙해지더군요. 특히 지문인식 기능은 많이 편하더군요. 잘 산것 같습니다.다음에도 좋은 상품 많이 준비해 주시고 경기도 안좋은데 대박 나시길 기원합니다."
14,130,LG-F700,G5,5,옥션,axe2****,16.05.03.,"좋습니다 좋구요 ~♡,♡",가격만족도/성능/사용편의성 등 : 공사지원금이랑 추가지원금 받았구요 / 인터넷검색이 톡톡빠르네요 / 배터리가 특이해서 처음엔 불편할것같았는데 어차피 안빼구 계속 쓰구있어요 좋아요 좋아요  상태/배송 : 개통해서 보내주는거라서 뜯겼을줄 알았는데 새제품이더라구요 !!! 배송도 다로다음날 우체국으로 잘 받았어요 ??이로 깔끔하게포장도 잘 되어있었구요 좋아요?아요 그 외 도움이 될 만한 사용후기 : 엘지사은품두 추가로 지금 받았는데 여기는 핸드폰올때도 또 사은품을 많이주시더라구요 ~~ 아직다 사용해보지는 못했지만 감사합니다~~배송도빠르고 g5도 맘에 쏙들어요 좋어요~~~~~^~^ 제폰이 화질이 좀구리네영 어둡어둡 g5가 환영해주구있어요 아무튼 다 좋아요?아여~~~~~ 옥션 안드로이드 앱으로 작성
15,130,LG-F700,G5,5,옥션,jbjs****,16.04.08.,사은품도 많이 주고 배송도 처리도 빠르고 만족합니다.,G5 밧데리 탈착하는 곳과 본체와 유격 없습니다.  발열도 그다지 없습니다. 괜찮습니다. 개인적으로 LG폰 만족하고 씁니다. G2 이후에... 그리고 디자인도 실물이 훨씬 낫네요.  배송도 처리도 빨라서 만족합니다. 가격은 다른 곳들이랑 동일해서 따로 말할 필요는 없구요. 아직 프렌즈는 받지 못해서 리뷰 못 올립니다.
16,130,LG-F700,G5,5,옥션,ksb9****,16.04.17.,아주 좋네요 ㅎㅎ, 노트3이용하다가 넘어왔는데일단 배송이빠른것부터가 정말 마음에드네요노트3도..썩 나쁜편은아닌데도g5의 빠릿함과 디자인..아주 만족스럽네요 ㅎㅎ 이렇게 판매해주시는것도 정말 감사하고 아직 사은품은 못받았지만엄청난 사은품들에 또 감사합니다폰을 바꾸려면 적어도 2년정도있어야하겠지만 그때도 판매하신다면또 구매하러오겠습니다.유격도없고 깨끗한 폰 보내주셔서 감사해요!! 
17,130,LG-F700,G5,5,옥션,kik*****,16.04.08.,내 생애처음 스마트폰 매우 만족합니다, 2G폰 계속 사용할 것처럼 버티고 있다가 G5가 매력적으로 보여 더는 버티지 못하고 내 생애처음 스마트폰 구입하여 사용하게 되었습니다. 처음 G5 구입하려고 마음먹고 오프라인 몇군데와 하이마트에 가보았지만 단통법으로 가격은 거의 모든곳이 같고 사은품을 별로 안 주더라구요 그래서 이곳 온라인으로 구입하여 많은 사은품을 받게 되고 배송도 빠르고 잘 선택한것 같아요아래는 사용하던2G과 새로 개통한 G5스마트폰 사진입니다
18,130,LG-F700,G5,5,옥션,du******,16.04.07.,G5 오늘 받아서 개통했습니다.,G2를 2년넘게 사용하다가 밧데리가 충전해도 몇시간을 못버티고 답답해 하다가~ 드디어 G5로 바꿨습니다. 예상대로 디자인도&색상 모두 마음에 듭니다. 배송도 빠르고 상담도 친절하시고~ 거기다 사은품 한다발 주시니 감동이네요~~  판매자분 감사하고요~ 많이 파시고 부자되시기 바랍니다~~속도도 빠르구요~ 
19,130,LG-F700,G5,5,인터파크,chod****,17.04.10.,배송도 빠르고 가격도 착한고,배송도 무척 빠르고 가격도 정말 저렴하고~핸드폰이 맛이 가서 새로 하려했는데.... 딱 원하는 가격대의 폰이 나왔네요. 나름 최신폰에 사양도 만족합니다.번창하세요  
20,130,LG-F700,G5,4,인터파크,echo****,17.08.20.,케이스 정도는  보내줄거라  생각  했는데,그렇습니다 폰이  가볍네요
1,131,LG-F500,G4,5,G마켓,jkc7****,16.06.13.,G4헌금구매,예전엣사용하던폰이 기능이저하되어 이번에 스펙이 엄청좋은 G4연금가로 구매했습니다 배송받고 며칠간 사용해보니  모든기능잘되고  특히 카메라 후면1600만 전면800만화소 라 서 사진 아주잘찍혀요[G마켓 안드로이드 앱에서 작성]
2,131,LG-F500,G4,4,신세계몰,khj0****,15.07.15.,잘 사용할께요~~,"스카이블루 색잘 사용할께요~~스카이블루 색상 받았는데, 예쁘네요~ 와인색을 받았으면 하는 아쉬움이 있었지만.... 갤럭시만 써오다가 이번에 엘지폰으로 넘어와봤는데 아직은 낯설지만,, 곧 적응하겠죠~^^아쉬운건~~ 투명 케이스라도 같이 있었으면....^^"
3,131,LG-F500,G4,5,인터파크,han*****,17.01.03.,sk  기기변경 lg  g4,sk텔레콤 기기변경 g4전에 부터 가지고 싶었던 폰인데 이번 기회에 아주 값싼가격으로 기기변경하게 되어서 정말 기쁘고요 기기값 한번 지불하니 기기값 할부가 없어서 정말 좋습니다 밧데리값 한개 가격으로 구매하였습니다
4,131,LG-F500,G4,5,인터파크,her*****,17.01.01.,skt g4 기변 온라인구매,기기변경이었습니다. 온라인구매라 망설임도 있었는데 배송도 좋았네요~ 걸제하고나니 메일이 왔고 가입신청서 쓰고 나니 담날 전화가왔네요
5,131,LG-F500,G4,5,인터파크,won*****,17.01.06.,잘쓸께요.,너무 좋으제품 싸게 잘 구입한거 같아서 만족합니다.이전에 g2 사용했었는데 g4로도 대만족합니다. ㅎㅎ번창하시고 앞으로도 좋은제품 많이 보여주세요.수고하세요 .
6,131,LG-F500,G4,5,옥션,jahw****,16.07.06.,감사합니다~!!,좋아요~!! 감사합니다 
7,131,LG-F500,G4,5,인터파크,junc****,16.08.10.,lg g4 싸게 잘샀습니다.,lg g4 저렴한 가격에 잘 구매  했습니다.여러 사이트 비교해 봤지만 여기가 제일  싸네오.？？
8,131,LG-F500,G4,5,인터파크,choi****,16.10.02.,잘샀어요,ㄱㅅㄱ득ㅈㄱㅅㄱㅈㅋㅊㄱㅈㄱㄷㄱㄷㄱㅈㅂㅈㅂㅈㅂㅈㅂㄴㆍㅍㅅㅇㅍㅅㅈㅂㄷㅋ디ㅣㅈ시싱ㆍ직ㅈㄷ?‥ㅅㄱㅎㅋㅇㄱ
9,131,LG-F500,G4,5,옥션,ddoh****,16.04.13.,조으네요,가격만족도/성능/사용편의성 등 :가격만족  성능만족 사용편의송만족 상태/배송 : 상태만족 재송만족 그 외 도움이 될 만한 사용후기 : 매우만족  옥션 안드로이드 앱으로 작성
10,131,LG-F500,G4,5,G마켓,kgg1****,16.03.23.,친절한 서비스 대만족입니다.,저렴하게 폰을 구입하게 되어서 대만족입니다.배송도 퀵으로 해주셔서 빠르게 받았습니다.요금제 안내도 잘 받았고 친절한 상담에 매우 만족합니다.많이 판내하세요~
11,131,LG-F500,G4,5,롯데홈쇼핑,tig*****,16.06.25.,배송 굿!(1박2일)  안심하고,배송 굿!(1박2일)  안심하고
12,131,LG-F500,G4,5,G마켓,a*******,16.03.10.,44444하,456하781027 456781027 456781027 456781027 456781027[G마켓 안드로이드 앱에서 작성]
13,131,LG-F500,G4,5,SSG닷컴,taij****,16.05.11.,잘 샀습니다.  맘에 들어요,잘 샀습니다.  맘에 들어요
14,131,LG-F500,G4,5,11번가,jy******,16.04.28.,너무마음에듭니다.적극추천합니다.,싸게 잘산듯마니파세요
15,131,LG-F500,G4,4,G마켓,naya****,16.01.11.,아주 좋아요~!^^ 아주 좋아요~!^^,아주 좋아요~!^^ 아주 좋아요~!^^ 아주 좋아요~!^^ 
16,131,LG-F500,G4,5,SSG닷컴,key3****,16.03.02.,LG-G4 현금완납폰 처음구매해보?,LG-G4 현금완납폰 처음구매해보는데 좋네요
17,131,LG-F500,G4,5,롯데홈쇼핑,venu****,16.02.20.,일주일 사용해 본 결과 g4 좋아요. 후기에는 열이...,일주일 사용해 본 결과 g4 좋아요. 후기에는 열이 난다고하여 망설이다가 저렴함에 구입하였는데 잘 선택한 거 같습니다.
18,131,LG-F500,G4,5,SSG닷컴,mygk****,16.02.22.,디자인이 생각보다 쫌 그렇고 LC,디자인이 생각보다 쫌 그렇고 LCD가 약간 휜것빼고는 만족합니다. 갤노트3와 성능이 비슷한 느낌이네요.
19,131,LG-F500,G4,5,SSG닷컴,rkdr****,16.03.21.,뭐 괜찮네요뭐 괜찮네요,뭐 괜찮네요뭐 괜찮네요
20,131,LG-F500,G4,5,롯데홈쇼핑,exec****,15.12.29.,잘 받았습니다.상품은 맘에 듭니다.직접 내방했는데 ...,잘 받았습니다.상품은 맘에 듭니다.직접 내방했는데 참 친절하게 잘해주신것 같습니다.
1,132,LG-F400,G3,5,11번가,ru******,17.03.22.,너무마음에듭니다.적극추천합니다.,상품도 좋고 조건도 좋게 잘 구매했습니다 배송도 빠르고 포장도 잘되어 왔습니다 문제없이 잘 사용했으면 좋겠습니다.
2,132,LG-F400,G3,4,인터파크,fu******,16.08.05.,잘 구입한거같네요,"배송이 하루지연되어서, 통화불통으로 힘들었네요.그래도, 가격이 정말좋았습니다.제조일자가 좀오래 되긴했어도, 성능에 전혀 지장이 없었습니다. "
3,132,LG-F400,G3,4,인터파크,whan****,16.08.25.,skt번호이동24개월약정lg전자 lg g3 cat6 32g lgf460st끼리35요금제완납상품가입비無유심후납,skt번호이동|24개월약정|lg전자 lg g3 cat6 32g lg-f460s|t끼리35요금제|완납상품|가입비無|유심후납|위약금=약정4|부가無|
4,132,LG-F400,G3,5,인터파크,id******,16.08.08.,좋아요,배송 빠르고 사장님 친절하시고 폰도 마음에 듭니다 요새 나오는 5~60만원대 폰의 성능인데 싸게 잘 샀네요원하던 칼라는 아니지만 흰색도 괜찮네요
5,132,LG-F400,G3,5,신세계몰,bdyo****,16.03.01.,착한가격 좋은품질 정확한배송~,착한가격 좋은품질 정확한배송~
6,132,LG-F400,G3,5,11번가,to******,15.02.02.,아주 만족합니다..,         아주 만족합니다.. 저렴하게 아주 잘삿네요.. 배송도 아주 빨랐구요.. 사은품으로 주신 블루투스. 셀카봉. 액정 잘받았습니다. 액정은 먼지하나 없이 잘붙여주셔서 감사합니다. 그런데 케이스가 같이 안왓네요..상품페이지상에는 주신다고 되어있는데요. 따로 연락드리겠습니다. 다음에 기회되면 다시 구매하겟습니다.. 많이 판매하시고 행복하세요.. 근데 사진 첨부해서 상품리뷰 작성하면 케익 기프티콘 보내주시는거죠?? ^^ 수고 하세요 
7,132,LG-F400,G3,5,11번가,kj******,16.07.24.,너무마음에듭니다.적극추천합니다.,싸게 잘 샀어요잘 쓸께요
8,132,LG-F400,G3,5,11번가,na******,15.08.25.,심플한 디자인 너무너무 맘에 드네요.^^ ,다른 매장에서 보기 힘든 친절함 다른 매장에서 보기 힘든 심플한 디자인 너무너무 맘에 드네요.^^  
9,132,LG-F400,G3,5,11번가,no******,15.08.19.,좋아요,"할부를 싫어해서 현금주고 샀는데. 싸게 잘 샀네요. LG 스맛폰은 처음인데, 버튼이 뒤에 있어 좀 낮서네요 "
10,132,LG-F400,G3,5,11번가,ry******,15.05.29.,너무마음에듭니다.적극추천합니다.,종아요
1,133,LG-F410,G3 A,5,11번가,ru******,17.03.22.,너무마음에듭니다.적극추천합니다.,상품도 좋고 조건도 좋게 잘 구매했습니다 배송도 빠르고 포장도 잘되어 왔습니다 문제없이 잘 사용했으면 좋겠습니다.
2,133,LG-F410,G3 A,4,인터파크,fu******,16.08.05.,잘 구입한거같네요,"배송이 하루지연되어서, 통화불통으로 힘들었네요.그래도, 가격이 정말좋았습니다.제조일자가 좀오래 되긴했어도, 성능에 전혀 지장이 없었습니다. "
3,133,LG-F410,G3 A,4,인터파크,whan****,16.08.25.,skt번호이동24개월약정lg전자 lg g3 cat6 32g lgf460st끼리35요금제완납상품가입비無유심후납,skt번호이동|24개월약정|lg전자 lg g3 cat6 32g lg-f460s|t끼리35요금제|완납상품|가입비無|유심후납|위약금=약정4|부가無|
4,133,LG-F410,G3 A,5,인터파크,id******,16.08.08.,좋아요,배송 빠르고 사장님 친절하시고 폰도 마음에 듭니다 요새 나오는 5~60만원대 폰의 성능인데 싸게 잘 샀네요원하던 칼라는 아니지만 흰색도 괜찮네요
5,133,LG-F410,G3 A,5,신세계몰,bdyo****,16.03.01.,착한가격 좋은품질 정확한배송~,착한가격 좋은품질 정확한배송~
6,133,LG-F410,G3 A,5,11번가,to******,15.02.02.,아주 만족합니다..,         아주 만족합니다.. 저렴하게 아주 잘삿네요.. 배송도 아주 빨랐구요.. 사은품으로 주신 블루투스. 셀카봉. 액정 잘받았습니다. 액정은 먼지하나 없이 잘붙여주셔서 감사합니다. 그런데 케이스가 같이 안왓네요..상품페이지상에는 주신다고 되어있는데요. 따로 연락드리겠습니다. 다음에 기회되면 다시 구매하겟습니다.. 많이 판매하시고 행복하세요.. 근데 사진 첨부해서 상품리뷰 작성하면 케익 기프티콘 보내주시는거죠?? ^^ 수고 하세요 
7,133,LG-F410,G3 A,5,11번가,kj******,16.07.24.,너무마음에듭니다.적극추천합니다.,싸게 잘 샀어요잘 쓸께요
8,133,LG-F410,G3 A,5,11번가,na******,15.08.25.,심플한 디자인 너무너무 맘에 드네요.^^ ,다른 매장에서 보기 힘든 친절함 다른 매장에서 보기 힘든 심플한 디자인 너무너무 맘에 드네요.^^  
9,133,LG-F410,G3 A,5,11번가,no******,15.08.19.,좋아요,"할부를 싫어해서 현금주고 샀는데. 싸게 잘 샀네요. LG 스맛폰은 처음인데, 버튼이 뒤에 있어 좀 낮서네요 "
10,133,LG-F410,G3 A,5,11번가,ry******,15.05.29.,너무마음에듭니다.적극추천합니다.,종아요
1,134,LG-F470,G3 Beat,3,11번가,ji******,15.03.31.,화질이 구려요,다른건 괜찮은데 화질이 너무 구려요 사진 화질 중요한데 다음엔 제일 고려해서 살 예정입니다   
1,136,LG-F460,G3.Cat6,5,11번가,ru******,17.03.22.,너무마음에듭니다.적극추천합니다.,상품도 좋고 조건도 좋게 잘 구매했습니다 배송도 빠르고 포장도 잘되어 왔습니다 문제없이 잘 사용했으면 좋겠습니다.
2,136,LG-F460,G3.Cat6,4,인터파크,fu******,16.08.05.,잘 구입한거같네요,"배송이 하루지연되어서, 통화불통으로 힘들었네요.그래도, 가격이 정말좋았습니다.제조일자가 좀오래 되긴했어도, 성능에 전혀 지장이 없었습니다. "
3,136,LG-F460,G3.Cat6,4,인터파크,whan****,16.08.25.,skt번호이동24개월약정lg전자 lg g3 cat6 32g lgf460st끼리35요금제완납상품가입비無유심후납,skt번호이동|24개월약정|lg전자 lg g3 cat6 32g lg-f460s|t끼리35요금제|완납상품|가입비無|유심후납|위약금=약정4|부가無|
4,136,LG-F460,G3.Cat6,5,인터파크,id******,16.08.08.,좋아요,배송 빠르고 사장님 친절하시고 폰도 마음에 듭니다 요새 나오는 5~60만원대 폰의 성능인데 싸게 잘 샀네요원하던 칼라는 아니지만 흰색도 괜찮네요
5,136,LG-F460,G3.Cat6,5,신세계몰,bdyo****,16.03.01.,착한가격 좋은품질 정확한배송~,착한가격 좋은품질 정확한배송~
6,136,LG-F460,G3.Cat6,5,11번가,to******,15.02.02.,아주 만족합니다..,         아주 만족합니다.. 저렴하게 아주 잘삿네요.. 배송도 아주 빨랐구요.. 사은품으로 주신 블루투스. 셀카봉. 액정 잘받았습니다. 액정은 먼지하나 없이 잘붙여주셔서 감사합니다. 그런데 케이스가 같이 안왓네요..상품페이지상에는 주신다고 되어있는데요. 따로 연락드리겠습니다. 다음에 기회되면 다시 구매하겟습니다.. 많이 판매하시고 행복하세요.. 근데 사진 첨부해서 상품리뷰 작성하면 케익 기프티콘 보내주시는거죠?? ^^ 수고 하세요 
7,136,LG-F460,G3.Cat6,5,11번가,kj******,16.07.24.,너무마음에듭니다.적극추천합니다.,싸게 잘 샀어요잘 쓸께요
8,136,LG-F460,G3.Cat6,5,11번가,na******,15.08.25.,심플한 디자인 너무너무 맘에 드네요.^^ ,다른 매장에서 보기 힘든 친절함 다른 매장에서 보기 힘든 심플한 디자인 너무너무 맘에 드네요.^^  
9,136,LG-F460,G3.Cat6,5,11번가,no******,15.08.19.,좋아요,"할부를 싫어해서 현금주고 샀는데. 싸게 잘 샀네요. LG 스맛폰은 처음인데, 버튼이 뒤에 있어 좀 낮서네요 "
10,136,LG-F460,G3.Cat6,5,11번가,ry******,15.05.29.,너무마음에듭니다.적극추천합니다.,종아요
1,137,LG-F320,G2,5,,qhfo****,11.07.01.,미국이민자,얼마전애 미국이민가서 핸드폰 보다가 추천핸드폰이 그거길래 삿더 니 좋더라구요 
2,137,LG-F320,G2,2,,ark1****,11.04.16.,이거는요,이거는 옵티머스2x의 해외 출시 모델입니다. 
3,137,LG-F320,G2,3,,5202****,11.04.14.,음.........2x처럼만 안되면 될텐데,이건왜 노바디스플레이 안쓰죠??
4,137,LG-F320,G2,5,,qhsw****,11.01.09.,갖고싶다...,htc는 약정 같은거 안한 다는데.... 어쩌지...
5,137,LG-F320,G2,5,,jaeh****,10.11.13.,ㅜㅜ 제발 국내 출시좀,제곧내
6,137,LG-F320,G2,5,,jaeh****,11.01.12.,만점!,윈도우폰7 기대합니다~
7,137,LG-F320,G2,5,,domo****,10.10.12.,아직 아는사람이 별로없군,ㅋㅋ윈7폰 굳
1,138,LG-F350,G Pro2,5,,77yy****,11.09.02.,애타게 목마르게 기다리는데 언제나 나올까요 ?,"매일 컴 켤때마다 최신뉴스,각종검색 통해 정보를 구하는데,아직 미니프로 국내에 신제품이 출시된다는 말은 없네요,이상하게 쿼티폰이 실제 엄청 편리하고,화면은 작아도 콤팩트한게 딱 원하는 제품인데아~ 아~ 나오긴 나오려나..."
2,138,LG-F350,G Pro2,5,,skyh****,12.08.05.,미니프로가아니라 ,레이프로같네요 ㅋㅋ 빨리나와랑
3,138,LG-F350,G Pro2,5,,skyh****,11.10.29.,나오면 무조건 살건데!!,왜 안나오나요 ㅠㅠ 아 기다리다 목빠지겠어요..X10 미니프로 재고가 다 없어질때까지 안나오려나..제발 빨리좀 나오게 해주세요 관계자분들~
4,138,LG-F350,G Pro2,5,,wick****,11.10.28.,약정 끝나면 바로 가서 지른다아!!!,2012년 1월!!! 꼬밍 순!! 그때까지 나와 있어라 이쁜아~~
5,138,LG-F350,G Pro2,5,,lina****,11.10.27.,언제나오려나???,나 약정끝나간다 어서 나와줘!!! 바로 지를께....
6,138,LG-F350,G Pro2,5,,roll****,11.10.21.,어서 나와라 미니프로야..,엉아가 기다리고 있당게.... 귀여운자식
7,138,LG-F350,G Pro2,5,,xcum****,11.10.30.,SNS만 하는 나에게 딱인데..,거기다 쿼티면 진짜.. 대박. 언제나오냐?
8,138,LG-F350,G Pro2,4,,moon****,11.09.29.,난 기대되는데 주위에선 별로라네요,만약에 듀얼코어에다가 dmb 되고 화면이 아주 약간더 큰 3.2인치 였다면아주 대박 날꺼 같은데 하지만 난 배터리만 오래간다면 대 만족일꺼 같음
9,138,LG-F350,G Pro2,5,,deni****,11.11.02.,화이트로 꼭나와줬으면..,언제나오려는거야?ㅋㅋㅋㅋㅋㅋㅋ
10,138,LG-F350,G Pro2,5,,i4an****,11.09.20.,국내 언제 정발되나요~~~?,이미 외국 온라인숍에서 구매해 사용중인 분들도 있더군요.x10 미니와는 비교불가라던데...지금 x10 미니 프로 사용중인데...암튼 다음엔 이걸로...
11,138,LG-F350,G Pro2,5,,ohln****,11.09.02.,나와줄리는 없겠지 ㅠㅠㅠㅠㅠ,가격 좀 떨어지면 익스팬시스같은데서 사야겠어요레알 내가 원하는 스펙인뎅태블릿+이거 쓰는게 짱일듯
1,140,LG-F310,Gx,5,,zzdu****,12.10.19.,이리 오너라,딴거 다 필없고 너만 기다린다 근데 gx는 갠적으로 디자인이 좀 그닥이군...ㅠ
2,140,LG-F310,Gx,5,,vask****,12.09.06.,스크님들아 믿습니다,꼭 들여와줘여지릅니다
3,140,LG-F310,Gx,5,,plut****,12.08.15.,이폰 제발 나왔음 ㅠㅠ,쿼드코어 이런거 다 필요없고 이폰 정발 되기만을 기다리고 있는데 아직 공식적인 소식이 들리지않네요ㅠ
4,140,LG-F310,Gx,5,,chng****,12.08.16.,SKT 이거꼭들여와주세요!! 기다리는중ㅠㅠ,출시되기만을기다리고있어요 엑스페리아S 무산되서 후속작나오기만을기다렸네요 이번에는꼭출시하시길!!!!!
1,150,LG-F820,U폰,5,G마켓,c*o*****,21.01.23.,초특급 익스프레스 S21울트라 수령~!,"사전예약 마지막날 구매해서 좀 늦게 받겠구나 생각했는데, 개통시작일 바로 택배발송해서 하루만에 수령함.빠른 스피드에 감동~!또한 너무 크면 좀 그렇겠다 생각했는데, 한속에 쏙 들어오는 그립감이 대 만족~! (다만, 구성품이 넘 심플)4G -> 5G 세상으로 대전환 기대가 크다.다음 교체 주기에 기회만 된다면 이곳을 통해 하고 싶다~!한가지 문의 : 투명젤리케이스와 액정보호필름은 따로 발송이 되는 건지?여하튼 대만족 합니다."
2,150,LG-F820,U폰,5,옥션,f*n*****,21.01.22.,사은품 하나도 없이 폰만 왔네요. 보호필름과 포토상품평...,사은품 하나도 없이 폰만 왔네요.보호필름과 포토상품평 남기니 삼성무선충전기 꼭 보내주세요.이전 폰도 여기서 구매해서 믿을수있고아마 다음번에도 여기서 기변할거 같네요.사실 사은품 많이 주는곳보다 폰을 더 저렴하게 받는게 더 좋죠.
3,150,LG-F820,U폰,5,G마켓,k*0*****,21.01.26.,갤럭시 s21 울트라 구매후기,주문 하루만에 빠른배송 감사합니다:) 폰 잘 받았습니다!ㅎㅎ 너무 맘에들고 예쁘네요😄
4,150,LG-F820,U폰,5,신세계몰,gr******,21.01.19.,"케이스2개, 필름까지 챙겨주겼어요 핸드폰 작동도 잘되고","케이스2개, 필름까지 챙겨주겼어요 핸드폰 작동도 잘되고 좋습니다. 감사합니다. 이어폰 충전기 모두 잘 왔습니다"
5,150,LG-F820,U폰,5,SSG닷컴,ju******,20.07.17.,화요일 구매 목요일 핸드폰 수령,화요일 구매 목요일 핸드폰 수령 했구요지금 금요일 오후인데 개통은 아직 안되었네요ㅜㅜ바로 개통안되니 조금 답답하긴 합니다..ㅜ
6,150,LG-F820,U폰,5,신세계몰,dd******,20.06.26.,넘나 예쁘죠? 선불로 휴대폰 사�,넘나 예쁘죠? 선불로 휴대폰 사고 기분 좋은 요금제로 갈아 타세요. 실 구매자 입니다 :)
7,150,LG-F820,U폰,5,SSG닷컴,tn******,20.06.03.,잘 받았습니다 감사합니다 ,잘 받았습니다 감사합니다 
8,150,LG-F820,U폰,5,신세계몰,mi******,20.05.14.,이틀만에 받아서 바고 다음날 개,이틀만에 받아서 바고 다음날 개통됐는데 유심을 넣지 못해서 쓰지 못하고있어요. 해피콜하시는분이 좀....
9,150,LG-F820,U폰,5,SSG닷컴,li******,20.05.07.,원하는 색상이 없어 며칠 기다리,"원하는 색상이 없어 며칠 기다리긴 했지만 가입조건도 좋고, 상담 게시판에 답글도 빨리 달아주셔서 아주 만족합니다."
10,150,LG-F820,U폰,5,신세계몰,oj******,20.03.24.,좋아요~  핸펀 배송은 빨랐고 개,좋아요~  핸펀 배송은 빨랐고 개통은 조금걸렸어요그래도 무지 친절하시고 좋았어요^^
11,150,LG-F820,U폰,5,SSG닷컴,ka******,19.12.30.,주말 전화문의가 불가한 점은 약,주말 전화문의가 불가한 점은 약간 불편했습니다.그래도 평일 문의 시 친절하게 안내해주셔서 좋았습니다~
12,150,LG-F820,U폰,5,G마켓,h*j*****,20.12.15.,만족합니다.,아들에게 선물하려고 아이폰12미니를 구매했습니다.다른데보다 싸구요. 배송도 빠르고 정말 잘 산거 같아요. 적극 추천합니다.
