,pl_id,pl_model_code,pl_name,star,market,write_id,upload_day,title,text
1,125,LM-G820,G8 ThinQ,5,인터파크,d*d*****,20.02.07.,좋은 제품 잘 샀어요!,블랙을 구매할려고 했는데 품절이라 블루로 받았는데 실제 컬러가 이뻐요.성능도 좋고 그립감도 좋고 맘에 듭니다.좋은 제품을 잘 샀어요.
2,125,LM-G820,G8 ThinQ,5,인터파크,h*u*****,20.04.09.,배송빨라요.,싸게 잘구매했어요. g8도 빠르고 좋은기기네요
3,125,LM-G820,G8 ThinQ,5,인터파크,t*1*****,20.02.07.,선물용으로 굿,LG에서 나온 폰중에 지금 가장 가성비좋은 폰이라고 봅니다!!! 화면 선명해보이더라구요어머니 폰으로 해드렸는데 굿해피콜 해주신분 엄청 친절하셨어요!!ㅎㅎㅎ 온라인신청서 넘나 간편하고 좋네요 굿굿
4,125,LM-G820,G8 ThinQ,5,인터파크,k*r*****,20.02.09.,lg g8,상담원 제가 많이 번거롭게 했는데 친절하게 대해주셔서 감사해요~ 덕분에 핸드폰 잘 받았어요~~잘쓸게요~~~^^
5,125,LM-G820,G8 ThinQ,5,옥션,g*s*****,20.02.18.,"빠른 개통, 배송 감사합니다 신청한 다음날 바로 받았습...","빠른 개통, 배송 감사합니다신청한 다음날 바로 받았습니다"
6,125,LM-G820,G8 ThinQ,5,인터파크,t*s*****,20.01.10.,저렴한 가격 좋아용^^,"전화기두  참좋구.. 빠른처리.. 그리구 해피콜할때 친절한 안내와, 추후 요금제 변경 시일에 관한 문자도 참 좋았습니다. 신청서작성할때도 견본이 나와있어 작성하기도 쉬웠습니다. 감사합니다. 저렴하게 좋은전화기 구매했어요. 잘쓰겠습니다. 번창하세요^^"
7,125,LM-G820,G8 ThinQ,5,인터파크,f*x*****,20.01.05.,좋아요~,좋은 조건으로 기기변경 했어요  미개봉상태로 하루만에 배송되고 유심만 끼우면 끝~ g8 좋아요.
8,125,LM-G820,G8 ThinQ,5,인터파크,h*m*****,20.01.10.,가족꺼도 같이 샀어요,제꺼 구매하면서 마음에 들어서 가족꺼까지 같이 구매했어요 잘 사용하고 계셔서 구매해드리길 잘한거 같네요
9,125,LM-G820,G8 ThinQ,5,인터파크,h*m*****,20.01.09.,만족스러워요,기기변경으로 오프라인에서 구매하기 힘들었는데 온라인에서 이렇게 잘 구매할지 몰랐습니다 마음에 들어요
10,125,LM-G820,G8 ThinQ,5,인터파크,y*j*****,20.02.20.,lg g8,저렴한 가격에 빠른 배송과 당일 개통
11,125,LM-G820,G8 ThinQ,5,인터파크,g*i*****,20.02.14.,좋은 가격에 기변...,마침 기변을 하려는 시점에서 좋은가격에 원하는 색상으로 기변 할수 있고 업무 처리도 빠르게 진행해주셔서 고맙습니다.
12,125,LM-G820,G8 ThinQ,5,인터파크,S*3*****,20.02.15.,핸드폰 구매,배송좋고 설명 잘받았고 음 좋네요
13,125,LM-G820,G8 ThinQ,5,SSG닷컴,ls******,20.02.10.,제품구입 관련 친절한 상담 감사,제품구입 관련 친절한 상담 감사드리며 잘 도착하여 개통했습니다
14,125,LM-G820,G8 ThinQ,5,인터파크,x*f*****,20.02.01.,오늘 제품 받았어요~,"혼자서도 usim, 데이터 등등 할수있게 잘 설명해주셔서 쉽게 했네요~ 추천합니다!"
15,125,LM-G820,G8 ThinQ,5,인터파크,h*n*****,20.02.08.,가성비짱 친절한 응대짱 잘쓰겠습니다~,응대친절히 잘해주셔서 기분좋게 기변하네요 사업 번창하세요^-^
16,125,LM-G820,G8 ThinQ,5,인터파크,h*y*****,20.01.23.,잘쓰고있음,만족하며 잘쓰고 있음  빠른배송고 좋고...
17,125,LM-G820,G8 ThinQ,5,11번가,so******,20.02.08.,최고예요,배송도 빠르고 개통도 빨라요.
18,125,LM-G820,G8 ThinQ,5,인터파크,n*w*****,20.01.21.,추천,저렴하게 잘 샀습니다
19,125,LM-G820,G8 ThinQ,5,SSG닷컴,dl******,20.02.01.,신청하고 바로 해피콜 받고 다음,신청하고 바로 해피콜 받고 다음날 배송 잘 받았습니다. 만족합니다~
20,125,LM-G820,G8 ThinQ,5,인터파크,m*k*****,20.01.22.,좋은가격 만족합니다.,"겨울철 핸드폰 방전,꺼짐이 심하여 인터파크에서 새핸펀 구입했는데 사용하니 좋네요~"
21,125,LM-G820,G8 ThinQ,5,SSG닷컴,ha******,20.01.19.,좋아요.......,좋아요.......
22,125,LM-G820,G8 ThinQ,5,인터파크,d*o*****,20.01.06.,베리굿,총알 배송에 정말 친절하시네요.. 대만족입니다 번창하세요
23,125,LM-G820,G8 ThinQ,4,인터파크,k*y*****,19.12.17.,짱 좋아요~~ 근데 흔하디 흔한 투명 젤리 커버라도 하,빠른 개통 짱 좋아요~~ 근데 흔하디 흔한 투명 젤리 커보라도 하나 보내주시지~~~ㅠㅠ  2% 부족하지만 나름 좋네요..
24,125,LM-G820,G8 ThinQ,5,G마켓,g*b*****,20.01.02.,빠르고 친절한 배송 감사 드려요.,빠르고 친절한 배송 감사 드려요.
25,125,LM-G820,G8 ThinQ,5,인터파크,k*c*****,19.12.06.,저렴하게 구매했습니다.,저렴하게 구매했습니다. 구매해서 개통까지 빠른시간내에 완료했습니다. 이제 최대한 오래 사용하는 일만 남았네요.. 많이 파세요~~
26,125,LM-G820,G8 ThinQ,5,옥션,sung****,19.09.11.,서류신청 후 간단한 해피콜 통화하고 배송하루만에 도착했...,서류신청 후 간단한 해피콜 통화하고 배송하루만에 도착했네요 기기변경이라 복잡한거 없었구요 원래 LG기기만 사용하는데 완전 저렴한 가격에 득템입니다~완납폰이라 옥션 쿠폰에 포인트에 m포인트까지 다 되네요~ 대박입니다~~~bbb사은품으로 주신 케이스는 임시로 쓸만하고요 필름은 풀커버필름이라 짱좋네요 그것두 2장이네요~~감사합니다 휴대폰 성능도 끝내줍니다~배그 복귀하고 첫판 바로 치킨먹고 MVP됐어요 ㅋㅋㅋ휴대폰 완죤 강추강추~~
27,125,LM-G820,G8 ThinQ,5,인터파크,i*y*****,19.10.02.,좋네요,"2016년 4월에 g5 구매해서 근 3년하고도 6개월 너무 좋네요! 폰도 좋지만 싸게사서, 또 주문 즉시  하루만에 배송 ! 또 3년이 지나면 여기서 구매합니다 감사합니다"
28,125,LM-G820,G8 ThinQ,5,옥션,r*a*****,20.03.19.,엄마사드렸어요  아주 좋아욤,엄마사드렸어요 아주 좋아욤
29,125,LM-G820,G8 ThinQ,5,G마켓,succ****,19.10.15.,배송도 빠르고 제품도 좋네요,빠른 배송에 아주 만족했고 전화 응대도 아주 좋았습니다. 제품은 현재 사용한지 보름이 넘었는데 불편한점은 없고 상품에 아주 만족합니다. 새상품이라 그런지 아주 좋네요
30,125,LM-G820,G8 ThinQ,5,옥션,lyc*****,19.10.04.,구형 저사양 폰을 쓰다가 최신폰을 써서 그런지 체감으로...,구형 저사양 폰을 쓰다가 최신폰을 써서 그런지 체감으로 아주 성능이 좋은 느낌이네요. 일단 좋아요. 만족!!!
31,125,LM-G820,G8 ThinQ,5,G마켓,sta*****,19.10.10.,너무좋아요,"친절하게 응대해주시고,  기기도 안전하게 잘배송�獰楮鄂畸枋�만 아니였으면 어제받았을텐데. 보통하루면배송받구요넘좋으니 님들도 구매망설이지마세용^^"
32,125,LM-G820,G8 ThinQ,5,옥션,o*e*****,19.12.24.,저렴하게 구입했네요...,저렴하게 구입했네요...
33,125,LM-G820,G8 ThinQ,5,옥션,as2*****,19.08.24.,좋은가격 빠른배송 좋아요,좋은가격 빠른배송 좋아요
34,125,LM-G820,G8 ThinQ,5,옥션,sara****,19.08.15.,좋은조건으로  잘받았습니다  감사합니다번창하세요  매...,좋은조건으로  잘받았습니다  감사합니다번창하세요  매우만족합니다 케이스랑 필름도 알아서  챙겨주시고 감사합니다
35,125,LM-G820,G8 ThinQ,4,인터파크,m*y*****,19.10.08.,g8상품평,싸게샀어요 추천합니다 요즘5g폰이 대세이긴 하지만 아직 lte폰이 좋아서 g8구매했습니다 처음왔을 때부터 발열이 심해서 하루지나니 괜찮았어요 사은품은 품절되어 일주일 후인 오늘 받긴 했지만 만족합니다
36,125,LM-G820,G8 ThinQ,5,옥션,fosi****,19.10.28.,단말기 수령 과정에서 제가 결례한 부분들을 사과합니다....,단말기 수령 과정에서 제가 결례한 부분들을 사과합니다. 죄송합니다. 물건은 잘 받았습니다.
37,125,LM-G820,G8 ThinQ,1,옥션,inte****,19.10.12.,"핸드폰 구매하고 필름한장,케이스하나도 안주는건 너무 하...","핸드폰 구매하고 필름한장,케이스하나도 안주는건 너무 하네요"
38,125,LM-G820,G8 ThinQ,5,인터파크,s*a*****,19.10.05.,잘샀어요,배송빠르고 개통.깔끔 쉬움
39,125,LM-G820,G8 ThinQ,5,인터파크,v*f*****,19.10.11.,빠르고 친절함,빠르게 와줘서 편하게 받앗습니다. 잘 작동되고 괜찬네요. 감사합니다.
40,125,LM-G820,G8 ThinQ,5,인터파크,s*u*****,19.09.23.,좋네요,배송빠르고 물건 좋은 물건 좋네요
41,125,LM-G820,G8 ThinQ,5,인터파크,s*s*****,19.10.02.,만족합니다,배송 정말 빠르네요 갑자기 부모님 폰이 고장나서 급하게 필요했는데 너무 좋아요!
42,125,LM-G820,G8 ThinQ,5,11번가,dr******,19.08.16.,최고예요,배송 빠르구요 해피콜 친절 안내 만족합니다 가격은 최저가!오랜만에 LG폰 써보는데 현재까지 만족합니다 가성비 최고에요 앞으로도 여기 애용하게  될거 같아요 번창하세요~
43,125,LM-G820,G8 ThinQ,5,옥션,021*****,19.10.06.,필름에 케이스까지 챙겨주시고 감사합니다.빠른처리 감사...,필름에 케이스까지 챙겨주시고 감사합니다.빠른처리 감사합니다.
44,125,LM-G820,G8 ThinQ,5,인터파크,q*f*****,19.09.22.,좋습니다,만족합니다 잘사용하게요~~
45,125,LM-G820,G8 ThinQ,4,옥션,byk*****,19.09.18.,잘 구매한 것 같아여,잘 구매한 것 같아여
1,126,LM-G710,G7 ThinQ,5,인터파크,god1****,19.03.06.,가격쌀때잘샀어요!,갑자기 가격이 내려가서 이 가격이 맞나 싶을 때 샀는데 정말 기기값은 없다고 생각될 정도로 싸게 구매했습니다. 유심신청을 안했는데  엄마 핸드폰이라서 유심 구매하는 게 까다로워서 하루 정도 엄마가 핸드폰을 못 썼네요ㅜㅠ 다음에는 꼭 유심 같이 구매할게요! 다른 색깔은 다 써봐서 안써본 색깔로 샀는데 좋네요.
2,126,LM-G710,G7 ThinQ,5,인터파크,bear****,19.03.12.,걱정했는데 완납으로 무사히잘옴,G7 SK기변 찾아봐도 10만원 이상인거가 많아서 신도림이나 강변가야하나고민했는데 인터넷으로도 저렴한걸 구매할수있을지 몰랐네요.79요금제 6개월 유지하고 요금제 변경하면 되고 핸드폰도 정상으로 잘 왔어요.기기완납처리도 잘 되어있고요. 
3,126,LM-G710,G7 ThinQ,3,인터파크,wint****,19.03.07.,빛샘현상에 극갈림 ... 뽑기 운 꽝인듯... 내일 a,"주문은 3월 3일인데, 폰 받은 날은 3월 7일임..  도중에 물량 없어서 물량 입고후 보내준다는 연락 받아서 그런가보다 함.   바로 대리점 가서 기변하고, 이것저것 확인 중...   하단 빛샘 발견, 게다가 이어폰 극갈림까지... 검색해보니 9월인가 새제품에 개선됐다고 하는데,  제조년월은 2018년 5월... 오래되도 한참 오래됐다. 아마 물량 없어서 구한다는 말이 어디 짱박힌거 구하다보니 그런듯...  그나마 a/s는 친절하다는데 낼 바로 찾아가야겠다.   새제품 바로 확인해보고 이래 저래 실망만... "
4,126,LM-G710,G7 ThinQ,5,인터파크,wjs*****,18.11.03.,제품만족합니다..,"나름 합리적인 가격으로 잘 구입한것 같아요.. 구입 과정에서 휴대폰 컬러 문의 했었는데,직원분 전화 응대가 빠르게 이뤄지지 않은 점, 서비스로 오는 글라스필름?이 와장창 깨져 있고, 사이즈 또한 g7에 많이 작았다는 점... 정도 아쉽네요. 참고로 대한통운 하루면 거의 받는데 3일째 인가 수령한 것 같습니다. 배송 기다리다가 중간에 핸드폰 안 되서 알려주신 대로 기존폰 전원을 대여섯번 껏다 켰다..아이고야...같은 날 발급신청한 롯데카드보다 더 늦게 오다니..충격 좀 받았네요.. 믿음의 배송 우체국택배 이용하시기를 정중히 권해드립니다. 그리고 엘지폰 6년 만인데.. 많이 발전했네요. G7 몹시 만족합니다!  "
5,126,LM-G710,G7 ThinQ,5,인터파크,sil*****,19.03.21.,파손보험은 대리점 방문해야..,온가족이라  그나마 괜찮게 했습니다 마이크로 유심  사용중이라  근처 커터기있는  대리점에서 유심 커팅해달라 해서 넣었어요 파손보험은 본인이 해야한대서 114전화했더니 기계에 유심만 끼운걸로 나온다고 대리점 방문해야 한다네요
6,126,LM-G710,G7 ThinQ,4,인터파크,sjs*****,18.08.15.,전화끊기고 3일후 토요일에 핸드폰 도착,"기존 유심 재활용안되는데 유심 안보내줘서 일요일 지나 월요일부터 전화사용 가격은 일반카페보다는 조금 싸지만 나머지는 엉망이었슴 케이스, 액정필름도 따로 보내줌. 전화끊기는거랑 진행에 대한 내용을 사전에 안내하라고!! 판매자 편의대로 판매마시고 조금 더 구매자 입장을 생각해 주길... 아주 화나는 구매였슴"
7,126,LM-G710,G7 ThinQ,3,인터파크,choj****,18.09.12.,엘지폰 비추,구입한지 17일 되는날 고장났네요 문자메세지 내용 하나도 안보이고 화면이 꺼졌다 켜졌다 저절로 되고 정말짜증나네요. 판매자는 14일 지나서 교품도 안되고 a/s 받으라하고 오늘 a/s 받고왔네요 고장 잘안나는 삼성으로 사세요. 정말 비추!
8,126,LM-G710,G7 ThinQ,4,인터파크,x00*****,18.11.15.,배송만 빼면 좋았어요~,주문한 당일 발송은 되었는데 택배사 문제로 배송이 지연되고 지연 배송되는날엔 해외에 있어 못받고 일주일뒤에 폰을 받을수있었네요.....ㅡㅡ 배송지연 관련해서 확인해봐주시고 친절하셨어요~~착한가격에 구매해서 배송만 빼면 만족합니다~
9,126,LM-G710,G7 ThinQ,1,옥션,ston****,19.07.06.,업그레이드도 안 되는 고물...,업그레이드도 안 되는 고물...
10,126,LM-G710,G7 ThinQ,5,인터파크,k*e*****,19.10.17.,아주 잘 받았습니다,어머니 핸드폰 바꿔드리려고 신청했었는데 받아보니 예쁘고 가벼워서 만족스러워하시네요 번창하세요~~!
11,126,LM-G710,G7 ThinQ,5,인터파크,rj******,19.04.26.,좋은제품 감사합니다.,좋은 제품 감사합니다. 필름이랑 케이스 없는게 아쉽지만 감사합니다.  
12,126,LM-G710,G7 ThinQ,5,인터파크,105*****,19.03.21.,굿베송,와이프거랑 제거링 두개했는데 빠르게 처리되고 배송되서 왔메요 다좋음데 무료로 주신 액정 필름이 좀작네요  지금 새로 주문하고 기다리고 있습니다
13,126,LM-G710,G7 ThinQ,5,옥션,howh****,19.05.17.,감사합니다,감사합니다감사합니다
14,126,LM-G710,G7 ThinQ,5,인터파크,105*****,19.03.21.,빠르고,배성빠르고 처리도 좋고 가격도 만족하고 모두 매우 민족합니다 많이 판매하세요
15,126,LM-G710,G7 ThinQ,5,인터파크,badh****,19.03.20.,배송빠르고 제품고 저렴하게 만족스럽게 받았습니다.," 두대 모두 양품 받았습니다.  한가지 아쉬운 점이라면 배송받은이후 usim끼우는것과 등록하는것 까지 미리 알려주셨으면, 아니 홈페이지에 간략히 써주셨더라면 더 좋았을거 같네요. 아주 만족합니다."
16,126,LM-G710,G7 ThinQ,5,인터파크,natu****,19.03.23.,빠르고 좋습니다.,원하는 색상으로 보내주셔서 감사합니다. 잘 쓰겠습니다~
17,126,LM-G710,G7 ThinQ,5,인터파크,kwle****,19.03.20.,잘받았네요,빠른배송 잘받았어요 원하는 색상이 없어 아쉽지만 기존폰 안끊기고 받고 바로 연결되서 좋네요
18,126,LM-G710,G7 ThinQ,5,인터파크,fre*****,19.03.26.,고맙습니다 잘받았습니다,고맙습니다  잘받았습니다
19,126,LM-G710,G7 ThinQ,5,인터파크,pro*****,19.03.21.,잘받았습니다,잘받았습니다 잘받았습니다 
20,126,LM-G710,G7 ThinQ,5,인터파크,ymj*****,19.05.07.,g7 좋아요.,제조일자가 2018년 5월이라 아쉽긴 하지만 쓸만합니다. 지금은 더 저렴하게 구입하는 사람들도 있지만 톡집사 쿠폰도 받고 해서 나름 저렴하게 구입했어요. 갤럭시7 에서 넘어왔는데 좋습니다.
21,126,LM-G710,G7 ThinQ,5,인터파크,hobb****,19.07.19.,아주 만족합니다.,"제품 신청에서 배송까지 하루정도 소요되었습니다. 제품 게시물과 같이 구매시 결재대금외 휴대폰과 관려된 할부원금은 없습니다.  제품도 개봉하지 않은 새제품이며, 저렴한 구매가격에 필름과 투명젤리케이스도 보내주셨습니다.  아주 만족합니다."
22,126,LM-G710,G7 ThinQ,5,인터파크,osc1****,19.03.28.,배송잘받았습니다 번창하세요,너무나도 저렴하게 구입해서 기분좋고 부산인데 하루만에와서 또 기분좋고 휴대폰오면 케이스사러 가야지 하고 생각하고있었는데  너무나 고급진 케이스2개에 고급진방탄필름까지 챙겨주시고 너무너무 감사합니다 음질도 성능도 아주마음에들어요 사업번창하세요 오래오래 잘사용하겠습니다 감사합니다
23,126,LM-G710,G7 ThinQ,5,인터파크,g*a*****,19.06.06.,추천,주문 후 해피콜 빨랐고 다음날 물건 받았습니다. 친절하고 빠른개통입니다. 추천요^^
24,126,LM-G710,G7 ThinQ,5,인터파크,dgh*****,19.05.28.,좋은 상품 감사합니다!, 접수도 빠르고 해피콜도 빠르고 배송도 빨라서 좋습니다. 좋은 상품 최고입니다!
25,126,LM-G710,G7 ThinQ,5,인터파크,c*w*****,19.08.21.,가성비갑,물건 잘 받았습니다. 휴대폰 다음에도 여기서 살게요!
26,126,LM-G710,G7 ThinQ,5,인터파크,tnwj****,19.03.29.,빠른 진행~ 좋아좋아,"주문 후 개통, 배송까지 빠르게 처리되어 불편함 없이 바꿨습니다생각보다색 너무 예쁨감사합니다~~~~ "
27,126,LM-G710,G7 ThinQ,5,인터파크,hg82****,19.07.08.,가성비가 좋음,"LG폰은 그리 인기가 좋지 않지만, 가성비는 정말 좋네요. 부디 고장 안나고 2년동안 잘 사용하였으면 합니다."
28,126,LM-G710,G7 ThinQ,5,인터파크,leeh****,19.07.14.,좋아요,저렴하게 구매했어요 ~~
29,126,LM-G710,G7 ThinQ,5,옥션,josh****,19.07.23.,아주좋아요,아주좋아요
30,126,LM-G710,G7 ThinQ,5,인터파크,pjj*****,19.06.27.,왕추천. 놓치면 후회,1마넌의 행복은 바로 이런것이죠.껄껄껄 할원 제로. 육구욕 6개월 심플코스로 유지후  변경가능. 스펙은 갤9 보다 좋은것같습니다.
31,126,LM-G710,G7 ThinQ,5,인터파크,d*l*****,19.06.13.,너무 맘에 들어요..,정말 저렴한 가격에 득템한거 같아서 좋아요 필요없는 선물대신 가격을 할인받은거 같아서 좋네요..
32,126,LM-G710,G7 ThinQ,5,인터파크,chid****,19.06.06.,g7  thinq 좋네요,"저렴한 가격에 잘 산데다 한동안 데이터도 맘놓고 쓰고, 다른분들 말처럼 신속, 친절, 정확 너무 좋네요. g7으로 글쓰고 있습니다^^"
33,126,LM-G710,G7 ThinQ,5,인터파크,pjj*****,19.06.27.,2대 기변완료,"스펙, 가격, 당일 접수후 배송까지 어느 한가지 부족함이 없네요. 2대 기변했습니다. 매우 만족합니다."
34,126,LM-G710,G7 ThinQ,5,인터파크,sun*****,19.06.24.,완전 좋아요..거의 공짜폰이네요.,"약 만원 내고, 69요금제 쓰고 6개월 후 요금 변경 가능합니다. 무제한 데이터 요금제는 56이 마지노선이라, 그리 차이나지도 않고요..."
35,126,LM-G710,G7 ThinQ,5,인터파크,e*r*****,19.06.11.,좋은가격에 잘 구매 했습니다,휴대폰 기기변경 좋은 조건으로 잘 했습니다. 고장없이 잘 쓸 일만 남았네요~^^
36,126,LM-G710,G7 ThinQ,5,인터파크,sin*****,19.06.17.,빠른배송 좋은기기,좋아요 배송은 빠르고 좋응 기기가 왔네요
37,126,LM-G710,G7 ThinQ,5,인터파크,hjd*****,19.05.22.,적극 추천합니다,"어제 주문해서 오늘 점심때 받아서 데이터 옮기고 있습니다. 친절하시고, 배송빠르고, 가성비 좋구요.... 적극 추천합니다."
38,126,LM-G710,G7 ThinQ,5,인터파크,kuk*****,19.06.14.,득템,저렴한가격 빠른배송 감사합니다
39,126,LM-G710,G7 ThinQ,5,인터파크,shin****,19.05.30.,성능 좋은 폰 싸게 사서 좋네요.,잘쓰겠습니다. 많이 파세요.
40,126,LM-G710,G7 ThinQ,5,인터파크,roi*****,19.05.05.,G7 플러스 잘 구매한 것같아요.,"사고 싶은 LG 스마트폰이었는데 저렴하게 잘 구매한 것 같습니다. 결제하고 나서 바로 메일 보내주시고, 해피콜도 빠르고, 휴대폰 배송도 빨라서 매우 만족합니다."
41,126,LM-G710,G7 ThinQ,5,인터파크,qtan****,19.02.20.,G7 결국 내 손에..ㅎㅎ,우선 기기값이 없이 구매한거예 큰 만족이고요  어차피 요금제는 데이터온비디오를 사용중이라 부담 없었습니다.  그리고같이 온 케이스 글라스 화면 보호기도 맘에 듭니다.  굳이 돈 들여서 케이스는 살필요 없을 것 같습니다.  잘 쓰겠습니다..부디 고장이 안 나야될텐데 ㅎㅎㅎ
42,126,LM-G710,G7 ThinQ,5,인터파크,thwl****,18.11.10.,밧데리가 일찍 닳아서 의심됩니다,밧데리가 너무 일찍 닳아서 새제품인지 의심이 되지만 일단 11월에 도착하여 kt 온라인 자체 사인품을  받아보지 못 한 점은 굉장히 불쾌합니다 정산상 문제라고 하는데 전산상의 문제 때문에 제가 사은품을 받아보지 못한 불편함을 겪었음에도 불구하고 사과 없는 점은 서비스가 굉장히 최악이라고 봅니다  그러나 상품 가격 자체는 굉장히 실질적으로 실용성 있기에 가성비 최고입니다!!!
43,126,LM-G710,G7 ThinQ,5,인터파크,oops****,19.03.20.,두번째 구매,제 핸드폰을 3개월전에 구입하고 만족해서 다시 와이프핸드폰을 같은곳 에서 구매했습니다 지인것까지 총 3대 구입했는대 만족합니다 빠른 처리 조아요^^
44,126,LM-G710,G7 ThinQ,5,인터파크,nacr****,19.04.13.,잘받았습니다,저렴한 가격에 2대 잘 받았습니다사은품도 맘에듭니다~~^^
45,126,LM-G710,G7 ThinQ,5,인터파크,nacr****,19.04.13.,잘받았습니다,저렴한 가격에 2대 잘 받았습니다 사은품도 맘에듭니다~~^^
46,126,LM-G710,G7 ThinQ,5,인터파크,brav****,19.03.29.,좋은 가격 좋은 조건,어머니 휴대폰이 오래돼었는데 마침 좋은 가격으로 나와서 기변 해드렸습니다.
47,126,LM-G710,G7 ThinQ,5,인터파크,zza*****,19.04.25.,좋아요,가격 배송 상품 모두 좋아요^^
48,126,LM-G710,G7 ThinQ,5,인터파크,miss****,19.04.26.,좋아요,g7 저렴하게 구매했어요~ 친철하고 배송 빠르고~ 감사합니다^^
49,126,LM-G710,G7 ThinQ,5,인터파크,shh*****,19.05.01.,친절하고 배송빨라요,저렴한가격에 구매했네요 빠른배송 감사합니다
50,126,LM-G710,G7 ThinQ,5,인터파크,forr****,19.03.19.,빠른 배송 저렴한 가격 좋습니다.,빠른 배송과 친절한 처리 감사합니다....!! 저렴하게 잘 샀네요... G7 잘 쓰겠습니다...^^ 번창하세요...^O6 
51,126,LM-G710,G7 ThinQ,5,인터파크,jet*****,19.03.24.,g7,g7 가성비 좋아요 .사은품도 많아요
52,126,LM-G710,G7 ThinQ,5,인터파크,kyw*****,19.03.18.,g7 좋네요,배송도 다음날오고 케이스도 괜찮은거 주시고 만족합니다
53,126,LM-G710,G7 ThinQ,5,인터파크,ccsl****,19.03.01.,배송빠르고,제품도 아주만족합니다.
54,126,LM-G710,G7 ThinQ,5,인터파크,sy01****,19.02.28.,배송빠르고 제품도 좋아요!!!!,사은품도 챙겨주셨는데 투명 케이스도 범퍼같이 탄탄하고 필름도 강화유리로 두개 챙겨주시고 너무 좋았어요 휴대폰은 언박싱으로 뽁뽁이에 감싸여서 안전하게 왔어요 이상없이 지금까지 만족하며 쓰는 중이에요:)
55,126,LM-G710,G7 ThinQ,5,인터파크,nice****,19.03.04.,빠른 배송에 감사합니다.,빠르고 신속한 처리에 감사합니다. 거의 무료료 G 8 휴대폰을 장만했네요.
56,126,LM-G710,G7 ThinQ,5,인터파크,chun****,19.03.04.,저렴한 가격 빠방한 사은품,칼같은 배송 확실한 일처리s8 쓰다 g7 넘어왔는데 마음에 드네요. 
57,126,LM-G710,G7 ThinQ,5,인터파크,yuh*****,19.02.26.,g7 기변 신뢰할만합니다,온라인 규모가 오프라인  거래를 넘어섰는데..신뢰감이 제일 문제지요..케이스 두개..강화필름까지 모두 수피겐으로 보내 주셔서  무한한 신뢰를 합니다..다만 제품 액정에 눌린 자국이 있어  대리점 가야할듯 합니다
58,126,LM-G710,G7 ThinQ,5,인터파크,love****,19.02.22.,G7 빠른 배송 만족합니다.,금일 받아 보니 답글과 같이 정말 꼭 필요한 사은품 매우 좋았습니다. 차주에 집에 있는 부모님 폰도 변경하여야 하는데 고려하려고 합니다. 즐 즐판하세요
59,126,LM-G710,G7 ThinQ,5,인터파크,123*****,19.02.26.,넘  좋아요~,판매자님도 친절하시고 이가격에 좋은제품을  배송도 빠릅니다
60,126,LM-G710,G7 ThinQ,5,인터파크,lee*****,19.02.10.,정말 좋아요~,"너무 갖고 싶었던 제품, 출고가 90을 69요금제로 8만원대 완납 구입, 최고 입니다. 카메라, 음질, 화사한 화질과 크지만 손에 딱 들어오는 디스플레이, 빠른 속도감, 약속한 사은품에 판매자님께 감사드립니다^.^ "
