,level_0,index,pl_id,pl_model_code,pl_name,star,market,write_id,upload_day,title,text
97,12,,11,A1784,아이폰7 Plus,4,인터파크,moon****,16.12.10.,너무 오래 기다려 받았어요,실버  아이폰 7  너무 오래 기다려서 받았어요. 실버 색상이 귀한지 ...구매 취소를 하고 싶었을 정도 였어요. 아무튼 아이폰을 워낙 좋아해서 디자인이나 색상 다 맘에 들어요. 잘 산거 같아요.
98,13,,11,A1784,아이폰7 Plus,5,인터파크,gom*****,16.12.08.,물품 확실하고 배송 빠르네요!,무리해서 구입하긴했는데! 좋긴좋네요!!!빠른 일처리 감사드리며 배송도 생각보다 빨랐어요!!!친절하고 포장 좋고 물건은 말할 것도 없이 좋네요!!!!!번창하세요!!!!
99,14,,11,A1784,아이폰7 Plus,5,인터파크,lhji****,16.12.05.,잘 사용하고 있습니다,제트블랙 바로 받을 수 있어서 좋았습니다. 이상 없이 잘 사용하고 있습니다
100,15,,11,A1784,아이폰7 Plus,3,인터파크,top*****,16.12.06.,갤7노트에서 환승,갤노7 밧데리에  열받아  갈아 탓더니 개불편 ㅠㅠㅠ 후회막급 ...다시. 돌아 가고 싶어요. 기능적으로는 갤럭시를 능가하기 힘듬
101,16,,11,A1784,아이폰7 Plus,5,인터파크,wow*****,16.12.05.,좋습니다,적절한 가격에 빠른배송으로 잘 받아보았습니다. 선택약정도 잘 되었고 사용하는데 이상없습니다 추천합니다
102,17,,11,A1784,아이폰7 Plus,4,인터파크,jyi*****,17.03.04.,정말 좋네요,가장 저렴하고 친절한 매장입니다 많이 파세요!! 아이폰으로 말하자면 아이폰 7+ 가 생각보다 무거운데 점차 적응되리라 봅니다 7 크기가 어느정도인지 모른체 사서 후회도 약간 하지만 화면이 큰게 더 중요하니까... 그리고 아쉽게도 카툭튀이고 카메라가 좀 느립니다
103,18,,11,A1784,아이폰7 Plus,3,인터파크,ink*****,17.01.15.,오래오래 쓰려고 애플선택,아이폰 처음사용하는 한사람으로써 이정도로 좋을지 몰랐네요... 휴대폰을 거의 3년이상 쓰기에 좀 비싸더라도 오래쓸 수있는 아이폰을 선택했습니다.  기존 G Pro와 아이폰 7 + 와 비교가 안되겠지만 이제서야 아이폰 유저들은 아이폰만 쓰는지 알겠더라구요... 오래오래 쓸수있도록 케이스도 좋은놈으로 구매해야 겠습니다...   삼성도 LG도 이에 버금가는 휴대폰을 만들수 있을까??? 만들어야 할텐대 ~
104,19,,11,A1784,아이폰7 Plus,5,11번가,le******,17.06.28.,최고예요,배송도 빠르고 친절하시네요잘쓰겠습니다
105,20,,11,A1784,아이폰7 Plus,5,11번가,sk******,17.02.26.,너무마음에듭니다.적극추천합니다.,너무 좋네요~~
106,21,,11,A1784,아이폰7 Plus,5,11번가,co******,16.12.29.,너무마음에듭니다.적극추천합니다.,제품 좋아요^^
107,22,,11,A1784,아이폰7 Plus,5,인터파크,ssu*****,16.12.07.,좋아요,일단 물건 확실하거 ㅋㅋㅋㅋㅋ 배송도 빠르고ㅠ확실하고 ㅋㅋㅋㅋㅋㅋ 아이폰도 맘에들고 이거저거 쿠폰가용하고ㅠ하니까 왠만한곳보다 싸게 구매가능하내요  무이자 할부고 이용하면 그렇게 부담스럽지도ㅠ않아요 굳이 이자내가면서 약정할필요없는듯
